{"$defs":{"constructor":{"$prototype":"Function","parameters":[{"$ref":"#/$defs/parameters/src"}],"role":"constructor"},"methods":{"resolve":{"$prototype":"Function","identifier":"resolve","parameters":[],"returns":{"type":"array"},"role":"method"}},"parameters":{"src":{"identifier":"src","type":{"type":"string"}}}},"$prototype":"Class","description":"Base query returning array","title":"BaseQuery"}