{"$prototype":"Class","title":"ContentCollection","description":"A collection that returns an array","$defs":{"parameters":{"contentType":{"identifier":"contentType","type":{"type":"string"},"description":"Content type to query"}},"constructor":{"role":"constructor","$prototype":"Function","parameters":[{"$ref":"#/$defs/parameters/contentType"}]},"methods":{"resolve":{"role":"method","$prototype":"Function","access":"public","scope":"instance","identifier":"resolve","parameters":[],"returns":{"type":"array"},"description":"Query entries"}}}}