{"$defs":{"constructor":{"$prototype":"Function","parameters":[{"$ref":"#/$defs/parameters/src"}],"role":"constructor"},"parameters":{"sortBy":{"description":"Sort field","identifier":"sortBy","type":{"type":"string"}},"src":{"description":"Source path","identifier":"src","type":{"type":"string"}}}},"$prototype":"Class","description":"Base collection class","title":"BaseCollection"}